Title,Authors_Institutes,Submission Date
Local Homophily-Aware Graph Neural Network with Adaptive Polynomial Filters for Scalable Graph Anomaly Detection,"Zengyi Wo (School of New Media and Communication, Tianjin University); Minglai Shao (School of New Media and Communications, Tianjin University); Shiyu Zhang (College of Intelligence and Computing, Tianjin University); Ruijie Wang (School of Computer Science and Engineering, Beihang Univerisity)",Not Found
Logical Anomaly Detection with Text-based Logic via Component-Aware Contrastive Language-Image Training,"Seung-eon Lee (School of Undergraduate, DGIST,ENERZAi); Soopil Kim (Robots and Mechatronics Engineering, DGIST,Division of Intelligent Robot, DGIST); Sion An (Robotics and Mechatronics Engineering, DGIST); Sang-Chul Lee (Division of Nanotechnology, DGIST); Sang Hyun Park (Robotics and Mechatronics Engineering, DGIST,The Interdisciplinary Studies of Artificial Intelligence, DGIST)",Not Found
Loss or Gain: Hierarchical Conditional Information Bottleneck Approach for Incomplete Time Series Classification,"Shuo Zhang (School of Computer Science and Technology, Beijing Jiaotong University); Jing Wang (School of Computer Science and Technology, Beijing Jiaotong University,Key Laboratory of Big Data & Artificial Intelligence in Transportation, Ministry of Education); Shiqin Nie (School of Computer Science and Technology, Beijing Jiaotong University); Jinghang Yue (School of Computer Science and Technology, Beijing Jiaotong University); Weikang Zhu (School of Computer Science and Technology, Beijing Jiaotong University); Youfang Lin (School of Computer Science and Technology, Beijing Jiaotong University,Beijing Key Laboratory of Traffic Data Mining and Embodied Intelligence)",Not Found
Lossless Set Compression by Binary Tree Coding,"Longtao Tang (Department of Data Science, City University of Hong Kong); Ying Zhou (Department of Economics and Finance, City University of Hong Kong); Yu Yang (Department of Data Science, City University of Hong Kong)",Not Found
Lost in Sequence: Do Large Language Models Understand Sequential Recommendation?,"Sein Kim (KAIST); HongSeok Kang (KAIST); Kibum Kim (KAIST); Jiwan Kim (KAIST); Donghyun Kim (NAVER Corperation); Min-Chul Yang (NAVER Corperation); Kwangjin Oh (NAVER Corperation); Julian McAuley (University of California, San Diego); Chanyoung Park (KAIST)",Not Found
LSRP: A Leader–Subordinate Retrieval Framework for Privacy-Preserving Cloud–Device Collaboration,"Yingyi Zhang (Dalian University of Technology,City University of Hong Kong); Pengyue Jia (City University of Hong Kong); Xianneng Li (Dalian University of Technology); Derong Xu (University of Science and Technology of China,City University of Hong Kong); Maolin Wang (City University of Hong Kong); Yichao Wang (Huawei Noah’s Ark Lab); Zhaocheng Du (Huawei Noah’s Ark Lab); Huifeng Guo (Huawei Noah’s Ark Lab); Yong Liu (Huawei Noah’s Ark Lab); Ruiming Tang (Huawei Noah’s Ark Lab); Xiangyu Zhao (City University of Hong Kong)","8 May, 2025"
FedGuCci: Making Local Models More Connected in Landscape for Federated Learning,"Zexi Li (University of Cambridge,Zhejiang University); Jie Lin (Zhejiang University); Zhiqi Li (Georgia Institute of Technology); Didi Zhu (Zhejiang University); Tao Shen (Zhejiang University); Tao Lin (Westlake University); Chao Wu (Zhejiang University); Nicholas D. Lane (University of Cambridge)","29 February, 2024"
MapExplorer: New Content Generation from Low-Dimensional Visualizations,"Xingjian Zhang (School of Information, University of Michigan – Ann Arbor); Ziyang Xiong (College of Engineering, University of Michigan – Ann Arbor); Shixuan Liu (Computer Science and Engineering, University of Michigan – Ann Arbor); Yutong Xie (School of Information, University of Michigan); Tolga Ergen (Ann Arbor Center, LG AI Research); Dongsub Shim (R&D, LG AI Research); Hua Xu (Yale School of Medicine, Yale University); Honglak Lee (Computer Science and Engineering, University of Michigan – Ann Arbor,R&D, LG AI Research); Qiaozhu Mei (School of Information, University of Michigan)","24 December, 2024"
Marionette: Fine-Grained Conditional Generative Modeling of Spatiotemporal Human Trajectory Data Beyond Imitation,Bangchao Deng (University of Macau); Ling Ding (University of Macau); Lianhua Ji (University of Macau); Chunhua Chen (University of Macau); Xin Jing (University of Macau); Bingqing Qu (Beijing Normal-Hong Kong Baptist University); Dingqi Yang (University of Macau),Not Found
Match: A Maximum-Likelihood Approach for Classification under Label Shift,"Zahra Donyavi (School of Computer science and Engineering, University of New South Wales); Feiyu Li (School of Computer Science and Engineering, University of New South Wales); Yunrui Zhang (School of Computer Science and Engineering, University of New South Wales); Diego Furtado Silva (Instituto de Ciências Matemáticas e de Computação, Universidade de São Paulo); Gustavo Enrique Batista (School of Computer Science and Engineering, University of New South Wales)",Not Found
Maximum Degree-Based Quasi-Clique Search via an Iterative Framework,"Hongbo Xia (Harbin Institute of Technology, Shenzhen); Kaiqiang Yu (Nanyang Technological University); Shengxin Liu (Harbin Institute of Technology, Shenzhen); Cheng Long (Nanyang Technological University); Xun Zhou (Harbin Institute of Technology, Shenzhen,Pengcheng Laboratory)","21 May, 2025"
MDVT: Enhancing Multimodal Recommendation with Model-Agnostic Multimodal-Driven Virtual Triplets,"Jinfeng Xu (Department of Electrical and Electronic Engineering, The University of Hong Kong); Zheyu Chen (Department of Electrical and Electronic Engineering, The Hong Kong Polytechnic University); Jinze Li (The Department of Electrical and Electronic Engineering, The University of Hong Kong); Shuo Yang (Department of Electrical and Electronic Engineering, The University of Hong Kong); Hewei Wang (Robotics Institute, Carnegie Mellon University); Yijie Li (Robotics Institute, Carnegie Mellon University); Mengran Li (School of Intelligent Systems Engineering, Sun Yat-sen University); Puzhen Wu (Population Health Sciences, Weill Cornell Medicine, Cornell University); Edith C. H. Ngai (Department of Electrical and Electronic Engineering, University of Hong Kong)",May 2025
Measure Domain’s Gap: A  Similar Domain Selection Principle for Multi-Domain Recommendation,"Yi Wen (City University of Hong Kong); Yue Liu (National University of Singapore); Derong Xu (City University of Hong Kong); Huishi Luo (Institute of Artificial Intelligence); Pengyue Jia (City University of Hong Kong); Yiqing Wu (Institution of Computation, Chinese Academy of Sciences); Siwei Wang (Intelligent Game and Decision Lab); Ke Liang (National University of Defense Technology); Maolin Wang (City University of Hong Kong); Yiqi Wang (National University of Defense Technology); Fuzhen Zhuang (Ins, Beihang University,State Key Laboratory of Complex & Critical Software Environment); Xiangyu Zhao (City University of Hong Kong)",May 2025
Measuring Item Freshness in Data Streams,"Zirui Liu (National Key Laboratory for Multimedia Information Processing, School of Computer Science, Peking University); Zihan Jiang (National Key Laboratory for Multimedia Information Processing, School of Computer Science, Peking University); An Zhang (National Key Laboratory for Multimedia Information Processing, School of Computer Science, Peking University); Zhouran Shi (The Hong Kong University of Science and Technology); Yuxuan Tian (National Key Laboratory for Multimedia Information Processing, School of Computer Science, Peking University); Tong Yang (National Key Laboratory for Multimedia Information Processing, School of Computer Science, Peking University)",Not Found
MedDiTPro: A Prompt-Guided Diffusion Transformer for Multimodal Longitudinal Medical Data Synthesis,Yuan Zhong (The Pennsylvania State University); Xiaochen Wang (The Pennsylvania State University); Jiaqi Wang (The Pennsylvania State University); Xiaokun Zhang (City University of Hong Kong); Fenglong Ma (The Pennsylvania State University),Not Found
Merlin: Multi-View Representation Learning for Robust Multivariate Time Series Forecasting with Unfixed Missing Rates,"Chengqing Yu (Institute of Computing Technology, Chinese Academy of Sciences,State Key Laboratory of AI Safety, University of Chinese Academy of Sciences); Fei Wang (Institute of Computing Technology, Chinese Academy of Sciences,State Key Laboratory of AI Safety, University of Chinese Academy of Sciences); Chuanguang Yang (Institute of Computing Technology, Chinese Academy of Sciences,State Key Laboratory of AI Safety); Zezhi Shao (Institute of Computing Technology, Chinese Academy of Sciences,State Key Laboratory of AI Safety); Tao Sun (Institute of Computing Technology, Chinese Academy of Sciences,State Key Laboratory of AI Safety); Tangwen Qian (Institute of Computing Technology, Chinese Academy of ScienceS,State Key Laboratory of AI Safety); Wei Wei (School of Computer Science and Technology, Huazhong University of Science and Technology); Zhulin An (Institute of Computing Technology, Chinese Academy of Sciences,State Key Laboratory of AI Safety, University of Chinese Academy of Sciences); Yongjun Xu (Institute of Computing Technology, Chinese Academy of Sciences,State Key Laboratory of AI Safety, University of Chinese Academy of Sciences)",June 2025
MetaEformer: Unveiling and Leveraging Meta-Patterns for Complex and Dynamic Systems Load Forecasting,Shaoyuan Huang (Tianjin University); Tiancheng Zhang (Tianjin University); Zhongtian Zhang (Tianjin University); Xiaofei Wang (Tianjin University); Lanjun Wang (Tianjin University); Xin Wang (Tianjin University),June 2025
MicroAdapt: Self-Evolutionary Dynamic Modeling Algorithms for Time-evolving Data Streams,"Yasuko Matsubara (SANKEN, Osaka University); Yasushi Sakurai (SANKEN, Osaka University)",Not Found
Mitigating Data Imbalance in Time Series Classification Based on Counterfactual Minority Samples Augmentation,"Lei Wang (School of Big Data and Software Engineering, Chongqing University); Shanshan Huang (School of Big Data and Software Engineering, Chongqing University); Chunyuan Zheng (School of Mathematical Sciences, Peking University); Jun Liao (School of Big Data and Software Engineering, Chongqing University); Xiaofei Zhu (School of Computer Science and Engineering, Chongqing University of Technology); Haoxuan Li (Center for Data Science, Peking University); Li Liu (School of Big Data and Software Engineering, Chongqing University)",Not Found
Mitigating Source Label Dependency in Time-Series Domain Adaptation under Label Shifts,"Jihye Na (School of Computing, Korea Advanced Institute of Science & Technology); Youngeun Nam (School of Computing, Korea Advanced Institute of Science and Technology); Junhyeok Kang (LG AI Research); Jae-Gil Lee (School of Computing, Korea Advanced Institute of Science and Technology)",Not Found
MockLLM: A Multi-Agent Behavior Collaboration Framework for Online Job Seeking and Recruiting,"Hongda Sun (Gaoling School of Artificial Intelligence, Renmin University of China); Hongzhan Lin (Engineering Research Center of Next-Generation Intelligent Search and Recommendation, Ministry of Education); Haiyu Yan (University of Chinese Academy of Sciences); Yang Song (Nanbeige Lab, BOSS Zhipin); Xin Gao (King Abdullah University of Science and Technology); Rui Yan (Gaoling School of Artificial Intelligence, Renmin University of China,School of Artificial Intelligence, Wuhan University)","28 May, 2024"
Modality-Aware Diffusion Augmentation with Consistent Subspace Disentanglement for Session-based Recommendation,"Jiajie Su (Department of Computer Science, Zhejiang University); Chaochao Chen (Department of Computer Science, Zhejiang University); Weiming Liu (Tiktok Bytedance); Yuhang Wang (School of Computer Science and Technology, Wuhan University of Science and Technology); Yihao Wang (School of Software Technology, Zhejiang University); Zheqi Lv (Department of Computer Science, Zhejiang University); Xiaolin Zheng (Department of Computer Science, Zhejiang University); Jianwei Yin (Department of Computer Science, Zhejiang University)",Not Found
MoDiff – Graph Generation with Motif-aware Diffusion Model,"Yuwei Xu (School of Data Science, The Chinese University of Hong Kong, Shenzhen); Chenhao Ma (School of Data Science, The Chinese University of Hong Kong, Shenzhen)",Not Found
Monitoring Robustness and Individual Fairness,"Ashutosh Gupta (IIT Bombay); Thomas A. Henzinger (Institute of Science and Technology Austria); Konstantin Kueffner (Institute of Science and Technology Austria); Kaushik Mallik (–, IMDEA Software Institute); David Pape (Department of Computer Science, Paris Lodron University of Salzburg)",June 2025
MOSS: Multi-Objective Optimization for Stable Rule Sets,"Brian Liu (Operations Research Center, Massachusetts Institute of Technology); Rahul Mazumder (Sloan School of Management, Massachusetts Institute of Technology)","1 June, 2025"
"MOTTO: A Mixture-of-Experts Framework for Multi-Treatment, Multi-Outcome Treatment Effect Estimation",Yiling Liu (Duke University); Wei Shi (AI at Meta); Chen Fu (AI at Meta); Ziyang Jiang (AI at Meta); Zhigang Hua (AI at Meta); David Carlson (Duke University),Not Found
MSHTrans: Multi-Scale Hypergraph Transformer with Time-Series Decomposition for Temporal Anomaly Detection,Zhaoliang Chen (Hong Kong Baptist University); Zhihao Wu (Zhejiang University); William K. Cheung (Hong Kong Baptist University); Hong-Ning Dai (Hong Kong Baptist University); Byron Choi (Hong Kong Baptist University); Jiming Liu (Hong Kong Baptist University),Not Found
MTM: A Multi-Scale Token Mixing Transformer for Irregular Multivariate Time Series Classification,"Shuhan Zhong (Department of Computer Science and Engineering, The Hong Kong University of Science and Technology); Weipeng Zhuo (Department of Computer Science, Beijing Normal-Hong Kong Baptist University); Sizhe Song (Department of Computer Science and Engineering, The Hong Kong University of Science and Technology); Guanyao Li (Guangzhou Urban Planning and Design Survey Research Institute); Zhongyi Yu (Department of Computer Science, Beijing Normal-Hong Kong Baptist University); S.-H. Gary Chan (Department of Computer Science and Engineering, The Hong Kong University of Science and Technology)",September 2025
Multi-Grained Preference Enhanced Transformer for Multi-Behavior Sequential Recommendation,Chuan He (Zhejiang University of Technology); Yongchao Liu (Ant Group); Qiang Li (Zhejiang University of Technology); Weiqiang Wang (Ant Group); Xing Fu (Ant Group); Xinyi Fu (Ant group); Chuntao Hong (Ant Group); Xinwei Yao (Zhejiang University of Technology),"18 November, 2024"
Multi-level Mixture of Experts for Multimodal Entity Linking,"Zhiwei Hu (Shanxi University, Shanxi University); Victor Gutierrez Basulto (School of Computer Science and Informatics, Cardiff University); Zhiliang Xiang (School of Computer Science and Informatics, Cardiff University); Ru Li (Shanxi University, Shanxi University); Jeff Z. Pan (School of Informatics, University of Edinburgh, University of Edinburgh)",July 2025
Multi-scale Physics-informed Transformer With Spatio-temporal Feature Adapter For Extreme Precipitation Nowcasting,Jingyuan Zheng (Hangzhou Dianzi University); Xin Zhang (Hangzhou Dianzi University); Zhilin Qi (Hangzhou Dianzi University); Ruiang Qiu (Hangzhou Dianzi University); Dongjing Wang (Hangzhou Dianzi University); Haiping Zhang (Hangzhou Dianzi University); Dongjin Yu (Hangzhou Dianzi University),Not Found
Multimodal Conditional Retrieval with High Controllability,"Xiaoda Yang (School of Software Technology, Zhejiang University); Xize Cheng (Zhejiang University); Minghui Fang (Zhejiang University); Hongshun Qiu (College of Computer Science, Beijing University of Technology); Yuhang Ma (ByteDance Inc.); JunYu Lu (China Merchants Research Institute of Advance Technology); Jiaqi Duan (School of Electronic and Information Engineering, Suzhou University of Technology); Sihang Cai (Zhejiang University); Zehan Wang (Zhejiang University); Ruofan Hu (Zhejiang University); Dongjie Fu (School of Software Technology, Zhejiang University); Zhou Zhao (Zhejiang University); Tao Jin (Zhejiang University)",Not Found
Network Interdiction Goes Neural,Lei Zhang (Northern Illinois University); Zhiqian Chen (Mississippi State University); Chang-Tien Lu (Virginia Tech); Liang Zhao (Emory University),May 2024
Non-exchangeable Conformal Prediction for Temporal Graph Neural Networks,"Tuo Wang (Department of Computer Science, Virginia Polytechnic Institute and State University); Jian Kang (Department of Computer Science, University of Rochester); Yujun Yan (Dartmouth College); Adithya Kulkarni (Virginia Polytechnic Institute and State University); Dawei Zhou (Virginia Polytechnic Institute and State University)",July 2025
Normalized Space Alignment: A Versatile Metric for Representation Analysis,Danish Ebadulla (UC Santa Barbara); Aditya Gulati (UC Santa Barbara); Ambuj Singh (UC Santa Barbara),November 2024
Offline Trajectory Optimization for Offline Reinforcement Learning,"Ziqi Zhao (Shandong University); Zhaochun Ren (Leiden University); Liu Yang (Shandong University); Yunsen Liang (Department of Computer Science, Shandong University); Fajie Yuan (ai, Westlake University); Pengjie Ren (Information Institute, Shandong University); Zhumin Chen (Shandong University); Jun Ma (Computer Science and Technology, Shandong University); Xin Xin (Shandong University)",July 2025
Oldie but Goodie: Re-illuminating Label Propagation on Graphs with Partially Observed Features,"Sukwon Yun (Department of Computer Science, University of North Carolina at Chapel Hill); Xin Liu (Intelligent Platforms Research Institute, AIST, National Institute of Advanced Industrial Science and Technology); Yunhak Oh (Data Science, Korea Advanced Institute of Science & Technology); Junseok Lee (KAIST); Tianlong Chen (CS, University of North Carolina at Chapel Hill); Tsuyoshi Murata (Department of Computer Science, Institute of Science Tokyo); Chanyoung Park (Industrial and Systems Engineering, Korea Advanced Institute of Science & Technology)",August 2025
On the Role of Weight Decay in Collaborative Filtering: A Popularity Perspective,"Donald Loveland (University of Michigan, Ann Arbor); Mingxuan Ju (Snap Inc.); Tong Zhao (Snap Inc.); Neil Shah (Snap Inc.); Danai Koutra (University of Michigan, Ann Arbor)","16 May, 2025"
On the Scalability of Temporal Relative Positional Encoding for Dynamic Link Prediction,"Ke Cheng (CCSE lab, Beihang University); Linzhi Peng (CCSE lab, Beihang University); Pengyang Wang (Computer and Information Science, University of Macau); Heng Chang (Huawei Technologies Co., Ltd); Junchen Ye (School of Transportation Science and Engineering, Beihang University); Bowen Du (School of Transportation Science and Engineering, Beihang University,Zhongguancun Laboratory)",Not Found
One-shot Multi-view Visual Conversational Recommendation,Noriaki Kawamae,Not Found
Optimising Budget Management via Primal-Dual Approximation with Constrained Polynomial Weights Update,Dmitrii Moor (Spotify); Per Berglund (Spotify); Hannes Karlbom (Spotify); Zhenwen Dai (Spotify); Kyle Kretschman (Spotify); Mounia Lalmas (Spotify),Not Found
Pairwise Sample Complexity for Fair Active Ranking with Cascaded Norm Objectives,"Sruthi Gorantla (Computer Science and Automation, Indian Institute of Science); Sara Ahmadian (Google Research)",Not Found
Paper-Level Computerized Adaptive Testing for High-Stakes Examination via Multi-Objective Optimization,Mingjia Li (East China Normal University); Junkai Tong (East China Normal University); Yiyang Huang (East China Normal University); Yifei Ding (East China Normal University); Hong Qian (East China Normal University); Aimin Zhou (East China Normal University),Not Found
PARSIFAL: Private and Robust Sign Federated Learning,"Runze Lei (MoE Key Lab for Intelligent Networks and Network Security, Xi’an Jiaotong University); Pinghui Wang (Xi’an Jiaotong University); Juxiang Zeng (XJTU, Xi’an Jiaotong University); Chenxu Wang (School of Software Engineering, Xi’an Jiaotong University); Hongbin Pei (School of Cyber Science and Engineering, Xi’an Jiaotong University); Junzhou Zhao (Cyber Science, Xi’an Jiaotong University)",Not Found
Partition-wise Graph Filtering: A Unified Perspective Through the Lens of Graph Coarsening,Guoming Li (Mohamed bin Zayed University of Artificial Intelligence); Jian Yang (University of Chinese Academy of Sciences); Yifan Chen (Hong Kong Baptist University),"20 May, 2025"
Paths to Causality: Finding Informative Subgraphs Within Knowledge Graphs for Knowledge-Based Causal Discovery,"Yuni Susanti (Fujitsu Limited); Michael Färber (ScaDS.AI, TU Dresden)",June 2025
PDMC: Generating Feasible Algorithmic Recourse via Perturbation Data Manifold Constraint,Zimu Wang (Tsinghua University); Hao Zou (Tsinghua University); Han Yu (Tsinghua University); Shaohua Fan (Tsinghua University); Haotian Wang (National University of Defense Technology); Yue He (Renmin University of China); Peng Cui (Tsinghua University),Not Found
Performative Time-Series Forecasting,"Zhiyuan Zhao (College of Computing, Georgia Institute of Technology); Haoxin Liu (College of Computing, Georgia Institute of Technology); Alexander Rodríguez (Computer Science and Engineering, University of Michigan); B. Aditya Prakash (College of Computing, Georgia Institute of Technology)",October 2025
PERSCEN: Learning Personalized Interaction Pattern and Scenario Preference for Multi-Scenario Matching,"Haotong Du (School of Computer Science, Northwestern Polytechnical University); Yaqing Wang (Artificial Intelligence and Machine Learning, Beijing Institute of Mathematical Sciences and Applications); Fei Xiong (Meituan); Lei Shao (Meituan); Ming Liu (Meituan); Hao Gu (DianPing, Meituan); Quanming Yao (Tsinghua University); Zhen Wang (School of Cybersecurity, Northwestern Polytechnical University)",June 2025
Persona Identification in E-Commerce with Scarce Labels and In-Context Graph Learning,"Anjali Gupta (Computer Science and Engineering, Indian Institute of Technology Delhi); Prashant Kumar (School of Infomation Technology, Indian Institute of Technology Delhi); Aniket Mishra (Computer Science and Engineering, Indian Institute of Technology Delhi); Abhishek Singh (Data Science, Flipkart Internet Pvt Ltd); Surender Kumar (Data Science, Flipkart Internet Pvt Ltd); Muthusamy Chelliah (Data Science, Flipkart Internet Pvt Ltd); Abhijnan Chakraborty (Computer Science and Engineering, Indian Institute of Technology Kharagpur); Sayan Ranu (Computer Science and Engineering, Indian Institute of Technology Delhi)",Not Found
Physics-Guided Learning of Meteorological Dynamics for Weather Downscaling and Forecasting,"Yingtao Luo (Carnegie Mellon University); Shikai Fang (Microsoft Research Asia); Binqing Wu (Zhejiang University); Qingsong Wen (Squirrel Ai Learning); Liang Sun (DAMO Academy, Alibaba Group)","20 May, 2025"
Player-Team Heterogeneous Interaction Graph Transformer for Soccer Outcome Prediction,"Lintao Wang (School of Computer Science, The University of Sydney); Shiwen Xu (The University of Sydney); Michael Horton (Stats Perform Limited); Joachim Gudmundsson (School of Computer Science, The University of Sydney); Zhiyong Wang (School of Computer Science, The University of Sydney)",July 2025
PMKLC: Parallel Multi-Knowledge Learning-based Lossless Compression for Large-Scale Genomics Database,"Hui Sun (College of C.S., Nankai University,College of CCSD, Nanyang Technological University); Yanfeng Ding (College of C.S., Nankai-Baidu Joint Lab, TMCC, SysNet, DISSec, GTIISC, Nankai University); Liping Yi (College of C.S., Nankai University,College of CCSD, Nanyang Technological University); Huidong Ma (College of C.S., Nankai-Baidu Joint Lab, TMCC, SysNet, DISSec, GTIISC, Nankai University); Gang Wang (College of C.S., Nankai-Baidu Joint Lab, TMCC, SysNet, DISSec, GTIISC, Nankai University); Xiaoguang Liu (College of C.S., Nankai-Baidu Joint Lab, TMCC, SysNet, DISSec, GTIISC, Nankai University); Cheng Zhong (School of Computer, Electronics and Information, Guangxi University); Wentong Cai (College of CCSD, Nanyang Technological University)",July 2025
Position-Aware Neighbor Aggregation for Dynamic Link Prediction,"Yumeng Zhou (CCSE Lab, Beihang University); Mingzhe Liu (CCSE Lab, Beihang University); Leilei Sun (CCSE Lab, Beihang University); Yifei Huang (CCSE Lab, Beihang University); Liangzhe Han (CCSE Lab, Beihang University); Chuanren Liu (The University of Tennessee); Tongyu Zhu (CCSE Lab, Beihang University)",Not Found
PPA-Game: Characterizing and Learning Competitive Dynamics Among Online Content Creators,"Renzhe Xu (MoE Key Laboratory of Interdisciplinary Research of Computation and Economics, ITCS, Shanghai University of Finance and Economics); Haotian Wang (College of Computer Science and Technology, National University of Defense Technology); Xingxuan Zhang (Department of Computer Science and Technology, Tsinghua University); Bo Li (School of Economics and Management, Tsinghua University); Peng Cui (Department of Computer Science and Technology, Tsinghua University)","22 March, 2024"
Practical contextual bandits for large-scale structured discrete constrained optimization problems,Pavithra Harsha (IBM Research); Chitra Subramanian (IBM Research); Naoki Abe (IBM Research); Shivaram Subramanian (IBM Research); Amadou Ba (IBM Research); Kevin Arturo Fernandez Roman (IBM CIO); Mauricio Longinos Garrido (IBM CIO); Chandrasekhar Narayanaswami (IBM Research),Not Found
