Title,Authors_Institutes,Submission Date
"“Oh LLM, I’m Asking Thee, Please Give Me a Decision Tree”: Zero-Shot Decision Tree Induction and Embedding with Large Language Models","Ricardo Knauer  (KI-Werkstatt, University of Applied Sciences Berlin); Mario Koddenbrock  (KI-Werkstatt, University of Applied Sciences Berlin); Raphael Wallsberger (KI-Werkstatt, University of Applied Sciences Berlin); Nicholas M. Brisson (Julius Wolff Institute, Berlin Institute of Health at Charité – Universitätsmedizin Berlin); Georg N. Duda (Julius Wolff Institute, Berlin Institute of Health at Charité – Universitätsmedizin Berlin); Deborah Falla (Centre of Precision Rehabilitation for Spinal Pain, School of Sport, Exercise and Rehabilitation Sciences at University of Birmingham); David W. Evans (Centre of Precision Rehabilitation for Spinal Pain, School of Sport, Exercise and Rehabilitation Sciences at University of Birmingham); Erik Rodner (KI-Werkstatt, University of Applied Sciences Berlin)",Not Found
A Diffusion-Based Method for Learning the Multi-Outcome Distribution of Medical Treatments,"Yuchen Ma (Institute of AI in Management, LMU Munich); Jonas Schweisthal (Institute of AI in Management, LMU Munich); Hengrui Zhang (University of Illinois, Chicago); Stefan Feuerriegel (Munich Center for Machine Learning, LMU Munich)",June 2025
A Dual-Fusion Cognitive Diagnosis Framework for Open Student Learning Environments,Yuanhao Liu (East China Normal University); Shuo Liu (East China Normal University); Yimeng Liu (East China Normal University); Chanjin Zheng (East China Normal University); Wei Zhang (East China Normal University); Hong Qian (East China Normal University),October 2024
A Fast and Accurate Block Compression Solution for Spatiotemporal Kernel Density Visualization,"Yue Zhong (College of Computer Science and Software Engineering, Shenzhen University); Tsz Nam Chan (College of Computer Science and Software Engineering, Shenzhen University); Leong Hou U (Department of Computer and Information Science, University of Macau); Dingming Wu (College of Computer Science and Software Engineering, Shenzhen University); Wei Tu (School of Architecture and Urban Planning, Shenzhen University); Ruisheng Wang (School of Architecture & Urban Planning, Shenzhen University); Joshua Huang (College of Computer Science and Software Engineering, Shenzhen University)",Not Found
A Scalable Pretraining Framework for Link Prediction with Efficient Adaptation,"Yu Song (Computer Science and Engineering, Michigan State University); Zhigang Hua (Monetization AI, Meta); Harry Shomer (Computer Science and Engineering, Michigan State University); Yan Xie (Monetization AI, Meta); Jingzhe Liu (Computer Science and Engineering, Michigan State University); Bo Long (Monetization AI, Meta); Hui Liu (Computer Science and Engineering, Michigan State University)",August 2025
A Two-Stage Data Selection Framework for Data-Efficient Model Training on Edge Devices,Chen Gong (Shanghai Jiao Tong University); Rui Xing (Shanghai Jiao Tong University); Zhenzhe Zheng (Shanghai Jiao Tong University); Fan Wu (Shanghai Jiao Tong University),"22 May, 2025"
A Unified Online-Offline Framework for Co-Branding Campaign Recommendations,Xiangxiang Dai (The Chinese University of Hong Kong); Xiaowei Sun (Fudan University); Jinhang Zuo (City University of Hong Kong); Xutong Liu (Carnegie Mellon University); John C.S. Lui (The Chinese University of Hong Kong),May 2025
A Unified Solution to Diverse Heterogeneities in One-Shot Federated Learning,"Jun Bai (McGill University,Mila-Quebec AI Institute); Yiliao Song (The University of Adelaide); Di Wu (University of Southern Queensland); Atul Sajjanhar (Deakin University); Yong Xiang (Deakin University); Wei Zhou (Monash University); Xiaohui Tao (University of Southern Queensland); Yan Li (University of Southern Queensland); Yue Li (McGill University,Mila-Quebec AI Institute)","28 October, 2024"
A/B Test and Online Experiment Under Diminishing Marginal Effects: Regret Minimization and Statistical Inference,"Jingxu Xu (Industrial Engineering & Operations Research, University of California, Berkeley); Yuhang Wu (Industrial Engineering and Operations Research, University of California, Berkeley); Yingfei Wang (Foster School of Business, University of Washington); Chu Wang (Amazon, Amazon); Zeyu Zheng (Department of Industrial Engineering and Operations Research, Berkeley Artificial Intelligence Research Lab, University of California, Berkeley)",Not Found
Accurate Graph-based Multi-Positive Unlabeled Learning via Disentangled Multi-view Feature Propagation,"Junghun Kim (IPAI, Seoul National University); Hoyoung Yoon (IPAI, Seoul National University); Ka Hyun Park (Computer Science and Engineering, Seoul National University); U Kang (Computer Science and Engineering, Seoul National University)",Not Found
Adapting Large Vision-Language Models to Visually-Aware Conversational Recommendation,"Hyunsik Jeon (Computer Science and Engineering, University of California, San Diego); Satoshi Koide (Toyota Motor Corporation); Yu Wang (Computer Science and Engineering, University of California, San Diego); Zhankui He (Google DeepMind); Julian McAuley (University of California, San Diego, University of California, San Diego)",March 2025
Adapting Pretrained Language Models for Citation Classification via Self-Supervised Contrastive Learning,"Tong Li (Department of Computer Science and Engineering, The Hong Kong University of Science and Technology); Jiachuan Wang (Department of Computer Science and Engineering, The Hong Kong University of Science and Technology); Yongqi Zhang (Thrust of Data Science And Analytics, The Hong Kong University of Science and Technology  (Guangzhou)); Shuangyin Li (School of Computer Science, South China Normal University); Lei Chen (Department of Computer Science and Engineering, The Hong Kong University of Science and Technology)","20 May, 2025"
Adaptive Conformal Prediction Intervals for Invariant Learning,"Shuxin Liang (Department of Mathematical and Statistical Sciences, University of Alberta); Yihan Xiao (College of Biomass Science and Engineering, Sichuan University); Linglong Kong (Department of Mathematical and Statistical Sciences, University of Alberta); Wenlu Tang (Department of Mathematical and Statistical Sciences, University of Alberta)",Not Found
Addressing and Visualizing Misalignments in Human Task-Solving Trajectories,Sejin Kim (GIST); Hosung Lee (KAIST); Sundong Kim (GIST),"21 September, 2024"
Addressing Correlated Latent Exogenous Variables in Debiased Recommender Systems,Shuqiang Zhang (Dalhousie University); Yuchao Zhang (Beijing University of Chemical Technology); Jinkun Chen (Dalhousie University); Haochen Sui (University of Michigan),June 2025
Advancing Graph Foundation Models: A Data-Centric Perspective,"Yuhan Li (HKUST  (GZ)); Yuyao Wang (HKUST  (GZ)); Jianheng Tang (HKUST  (GZ)); Heng Chang (Huawei Technologies Co., Ltd.); Yuxiang Ren (Nanjing University); Jia Li (HKUST  (GZ))",Not Found
Advancing Molecular Graph-Text Pre-training via Fine-grained Alignment,"Yibo Li (School of Computer Science, Beijing University of Posts and Telecommunications); Yuan Fang (School of Computing and Information Systems, Singapore Management University); Mengmei Zhang (China Telecom Bestpay); Chuan Shi (Institute of Computing Technology, Beijing University of Post and Telecommunication)","21 September, 2024"
Advancing Tool-Augmented Large Language Models via Meta-Verification and Reflection Learning,"Zhiyuan Ma (State Key Laboratory of Cognitive Intelligence, University of Science and Technology of China); Jiayu Liu (State Key Laboratory of Cognitive Intelligence, University of Science and Technology of China); Xianzhen Luo (Research Center for Social Computing and Interactive Robotics, Harbin Institute of Techology); Zhenya Huang (State Key Laboratory of Cognitive Intelligence, University of Science and Technology of China); Qingfu Zhu (Research Center for Social Computing and Interactive Robotics, Harbin Institute of Technology); Wanxiang Che (Research Center for Social Computing and Interactive Robotics, Harbin Institute of Technology)",June 2025
AffinityTune: A Prompt-Tuning Framework for Few-Shot Anomaly Detection on Graphs,"Jingyan Chen (School of Computer Science, Nanjing University); Guanghui Zhu (School of Computer Science, Nanjing University); Guansong Pang (School of Computing and Information Systems, Singapore Management University); Chunfeng Yuan (School of Computer Science, Nanjing University); Yihua Huang (School of Computer Science, Nanjing University)",Not Found
AGODE: Adaptive Graph ODE for Grid-free Fluid Modeling and Domain Adaptation,"Jie Lv (School of Artificial Intelligence, Xidian University,Research Center, Zhejiang Dahua Technology Co.,Ltd.); Shuyuan Yang (School of Artificial Intelligence, Xidian University); Zhixi Feng (School of Artificial Intelligence, Xidian University)",Not Found
AlphaAgent: LLM-Driven Alpha Mining with Regularized Exploration to Counteract Alpha Decay,"Ziyi Tang (School of Computer Science and Engineering, SUN YAT-SEN UNIVERSITY); Zechuan Chen (SCHOOL OF COMPUTER SCIENCE AND ENGINEERING, Sun Yat-Sen University); Jiarui Yang (School of Computer Science And Engineering, SUN YAT-SEN UNIVERSITY); Jiayao Mai (University of New South Wales); Yongsen Zheng (Nanyang Technological University); Keze Wang (SUN YAT-SEN UNIVERSITY); Jinrui Chen (School of Management and Economics, The Chinese University of Hong Kong); Liang Lin (School of Comuputer Science and Engineering, SUN YAT-SEN UNIVERSITY)","23 February, 2025"
Alpine: Partial Unlabeled Graph Alignment,"Petros Petsinis (Aarhus University); Konstantinos Skitsas (Aarhus University); Sayan Ranu (Indian Institute of Technology Delhi); Davide Mottin (Aarhus University); Panagiotis Karras (University of Copenhagen,Aarhus University)",Not Found
ALSA: Context-Sensitive Prompt Privacy Preservation in Large Language Models,"Hongru Ma (School of Software, Beihang University); Wenpeng Lu (Key Laboratory of Computing Power Network and Information Security, Ministry of Education, Shandong Computer Science Center  (National Supercomputer Center in Jinan), Qilu University of Technology  (Shandong Academy of Sciences)); Yanjie Liang (School of Software, Shandong University); Tianyi Wang (School of Computing, National University of Singapore); Qi Zhang (Department of Computer Science and Technology, Tongji University); Yingjie Zhu (School of Computer Science and Technology, Harbin Institute of Technology  (Shenzhen)); Jiasheng Si (Key Laboratory of Computing Power Network and Information Security, Ministry of Education, Shandong Computer Science Center  (National Supercomputer Center in Jinan), Qilu University of Technology  (Shandong Academy of Sciences))",Not Found
An Efficient White-box LLM Watermarking for IP Protection on Online Market Platforms,"Shuguang Yuan (State Key Laboratory of Cyberspace Security Defense, Institute of Information Engineering, Chinese Academy of Sciences); Xingyu Su (State Key Laboratory of Cyberspace Security Defense, Institute of Information Engineering, Chinese Academy of Sciences,School of Cyber Security, University of Chinese Academy of Science); Peizhuo Lv (College of Computing and Data Science, Nanyang Technological University); Weiji Xue (State Key Laboratory of Cyberspace Security Defense, Institute of Information Engineering, Chinese Academy of Sciences,School of Cyber Security, University of Chinese Academy of Science); Jing Yu (State Key Laboratory of Cyberspace Security Defense, Institute of Information Engineering, Chinese Academy of Sciences,School of Cyber Security, University of Chinese Academy of Science); Xiaojie Zhu (King Abdullah University of Science and Technology); Chi Chen (State Key Laboratory of Cyberspace Security Defense, Institute of Information Engineering, Chinese Academy of Sciences,School of Cyber Security, University of Chinese Academy of Science)",Not Found
An Optimization Framework for Differentially Private Sparse Fine-Tuning,"Mehdi Makni (Operations Research Center, Massachusetts Institute of Technology); Kayhan Behdin (LinkedIn); Gabriel Afriat (Operations Research Center, Massachusetts Institute of Technology); Zheng Xu (Google Research, Google); Sergei Vassilvitskii (Research, Google); Natalia Ponomareva (research, Google); Rahul Mazumder (Sloan School of Management, Massachusetts Institute of Technology); Hussein Hazimeh (Google)",March 2025
AnomalyGFM: Graph Foundation Model for Zero/Few-shot Anomaly Detection,"Hezhe Qiao (School of Computing and Information Systems, Singapore Management University); Chaoxi Niu (Australian Artificial Intelligence Institute, University of Technology Sydney); Ling Chen (Australian Artificial Intelligence Institute, University of Technology Sydney); Guansong Pang (School of Computing and Information Systems, Singapore Management University)","13 February, 2025"
Anytime Algorithms for Approximate Functional Dependencies,"Sanjivni Rana (University of Texas at Arlington); Junya Ogawa (University of Texas at Arlington); Suraj Shetiya (Indian Institute of Technology, Bombay); Senjuti Basu Roy (New Jersey Institute of Technology); Gautam Das (Computer Science and Engineering, University of Texas at Arlington)",Not Found
Are You Using Reliable Graph Prompts? Trojan Prompt Attacks on Graph Neural Networks,Minhua Lin (The Pennsylvania State University); Zhiwei Zhang (The Pennsylvania State University); Enyan Dai (Hong Kong University of Science and Technology  (Guangzhou)); Zongyu Wu (The Pennsylvania State University); Yilong Wang (The Pennsylvania State University); Xiang Zhang (The Pennsylvania State University); Suhang Wang (The Pennsylvania State University),Not Found
Are Your Fairness Metrics Accurate? A Semi-Supervised Approach to Improving Fairness Estimates Under Sample Selection Bias,"M. Clara De Paolis Kaluza (Khoury College of Computer Sciences, Northeastern University); Thulasi Tholeti (Institute for Experiential AI, Northeastern University); Yile Chen (Department of Biomedical Informatics and Medical Education, University of Washington); Ricardo Baeza-Yates (AI Institute, Barcelona Supercomputing Center); Predrag Radivojac (Khoury College of Computer Sciences, Northeastern University); Shantanu Jain (Institute for Experiential AI, Northeastern University)",Not Found
ArnoldiGCL: Graph Contrastive Learning via Learnable Arnoldi-Based Guided Spectral Chebyshev Polynomial Filters,"Mustafa Coskun (Artificial Intelligence and Data Engineering, Ankara University); Abdelkader Baggag (Qatar Computing Research Institute, Hamad Bin Khalifa University); Mehmet Koyutürk (Dept. of Computer and Data Sciences, Case Western Reserve University)",Not Found
ATOM: A Framework of Detecting Query-Based Model Extraction Attacks for Graph Neural Networks,"Zhan Cheng (Department of Mathematics, University of Wisconsin – Madison); Bolin Shen (Florida State University); Tianming Sha (Department of Computer Science, Arizona State University); Yuan Gao (Department of Computer Sciences, University of Wisconsin – Madison); Shibo Li (Department of Computer Science, Florida State University); Yushun Dong (CS, Florida State University)",March 2025
AtomR: Atomic Operator-Empowered Large Language Models for Heterogeneous Knowledge Reasoning,Amy Xin (Tsinghua University); Jinxin Liu (Tsinghua University); Zijun Yao (Tsinghua University); Zhicheng Lee (Tsinghua University); Shulin Cao (Zhipu AI); Lei Hou (Tsinghua University); Juanzi Li (Tsinghua University),"25 November, 2024"
Auto-Bidding in Real-Time Auctions via Oracle Imitation Learning,Alberto Silvio Chiappa (EPFL); Briti Gangopadhyay (Sony Group Corporation); Zhao Wang (Sony Group Corporation); Shingo Takamatsu (Sony Group Corporation),"15 December, 2024"
Bayesian Optimization for Simultaneous Selection of Machine Learning Algorithms and Hyperparameters on Shared Latent Space,"Kazuki Ishikawa (Graduate School of Engineering, Nagoya Institute of Technology); Ryota Ozaki (Nagoya Institute of Technology); Yohei Kanzaki (Nagoya Institute of Technology); Ichiro Takeuchi (Nagoya University); Masayuki Karasuyama (Department of Computer Science, Nagoya Institute of Technology)",February 2025
Bayesian Stream Tuner: Dynamic Hyperparameter Optimization for Real-Time Data Streams,"Nilesh Verma (AI Institute, University of Waikato); Albert Bifet (AI Institute, The University of Waikato); Bernhard Pfahringer (Department of Computer Science, The University of Waikato); Maroua Bahri (Sorbonne Université, CNRS, LIP6)",Not Found
Beyond Advertising: Mechanism Design for Platform-Wide Marketing Service “QuanZhanTui”,"Ningyuan Li (CFCS, School of CS, Peking University); Zhilin Zhang (Alibaba Group); Tianyan Long (School of EECS, Peking University); Yuyao Liu (Alibaba Group); Rongquan Bai (Alibaba Group); Yurong Chen (Inria, Ecole Normale Supérieure, PSL Research University); Xiaotie Deng (CFCS, School of CS & CMAR, Institute for AI, Peking University); Pengjie Wang (Alibaba Group); Chuan Yu (Alibaba Group); Jian Xu (Alibaba Group); Bo Zheng (Alibaba Group)",July 2025
Beyond Fixed Variables: Expanding-variate Time Series Forecasting via Flat Scheme and Spatio-temporal Focal Learning,"Minbo Ma (School of Computing and Artificial Intelligence, Southwest Jiaotong University,Faculty of Mathematics and Computer Science, FernUniversität in Hagen); Kai Tang (School of Computing and Artificial Intelligence, Southwest Jiaotong University); Huan Li (Zhejiang University); Fei Teng (School of Computing and Artificial Intelligence, Southwest Jiaotong University,Engineering Research Center of Sustainable Urban Intelligent Transportation, Ministry of Education); Dalin Zhang (Department of Computer Science, Aalborg University); Tianrui Li (School of Computing and Artificial Intelligence, Southwest Jiaotong University,Engineering Research Center of Sustainable Urban Intelligent Transportation, Ministry of Education)","21 February, 2025"
Beyond Locations: A Motion Range-Aware Similarity Join,"Ke Li (University of Electronic Science and Technology of China); Lisi Chen (School of Computer Engineering, University of Electronic Science and Technology of China); Shuo Shang (CS, University of Electronic Science and Technology of China); Christian Jensen (Department of Computer Science, Aalborg University); Panos Kalnis (KAUST)",Not Found
Bi-Modal Learning for Networked Time Series,"Youngeun Nam (School of Computing, Korea Advanced Institute of Science and Technology); Jihye Na (School of Computing, Korea Advanced Institute of Science & Technology); Susik Yoon (Computer Science and Engineering, Korea University); Hwanjun Song (Industrial and Systems Engineering, Korea Advanced Institute of Science & Technology); Jae-Gil Lee (School of Computing, Korea Advanced Institute of Science and Technology); Byung Suk Lee (University of Vermont)",Not Found
Bias Detection via Maximum Subgroup Discrepancy,"Jiří Němeček (Czech Technical University in Prague, Faculty of Electrical Engineering); Mark Kozdoba (Technion); Illia Kryvoviaz (Czech Technical University in Prague, Faculty of Electrical Engineering); Tomáš Pevný (Czech Technical University in Prague, Faculty of Electrical Engineering); Jakub Mareček (Czech Technical University in Prague, Faculty of Electrical Engineering)","4 February, 2025"
Bidirectional Diffusion Bridge Models,"Duc Kieu (Applied Artificial Intelligence Initiative, Deakin University); Kien Do (Applied Artificial Intelligence Initiative, Deakin University); Toan Nguyen (Applied Artificial Intelligence Initiative, Deakin University); Dang Nguyen (Applied Artificial Intelligence Initiative, Deakin University); Thin Nguyen (Applied Artificial Intelligence Initiative, Deakin University)",August 2025
BiQAP: Neural Bi-level Optimization-based Framework for Solving Quadratic Assignment Problems,"Liangliang Shi (Shanghai Institute for Mathematics and Interdisciplinary Sciences); Haoran Zhang (Shanghai Jiao Tong University); Shuheng Shen (Ant Group); Changhua Meng (Ant Group); Weiqiang Wang (Ant Group); Junchi Yan (School of Artificial Intelligence, Shanghai Jiao Tong University)",Not Found
BLAST: Balanced Sampling Time Series Corpus for Universal Forecasting Models,"Zezhi Shao (Institute of Computing Technology, Chinese Academy of Sciences,State Key Laboratory of AI Safety); Yujie Li (Institute of Computing Technology, Chinese Academy of Sciences,State Key Laboratory of AI Safety); Fei Wang (Institute of Computing Technology, Chinese Academy of Sciences,State Key Laboratory of AI Safety); Chengqing Yu (Institute of Computing Technology, Chinese Academy of Sciences,State Key Laboratory of AI Safety); Yisong Fu (Institute of Computing Technology, Chinese Academy of Sciences,State Key Laboratory of AI Safety); Tangwen Qian (Institute of Computing Technology, Chinese Academy of Sciences,State Key Laboratory of AI Safety); Bin Xu (Institute of Computing Technology, Chinese Academy of Sciences,State Key Laboratory of AI Safety); Boyu Diao (Institute of Computing Technology, Chinese Academy of Sciences.,State Key Laboratory of AI Safety); Yongjun Xu (Institute of Computing Technology, Chinese Academy of Sciences,State Key Laboratory of AI Safety); Xueqi Cheng (Institute of Computing Technology, Chinese Academy,State Key Laboratory of AI Safety)","23 May, 2025"
Blurred Encoding for Trajectory Representation Learning,Silin Zhou (University of Electronic Science and Technology of China); Yao Chen (National University of Singapore); Shuo Shang (University of Electronic Science and Technology of China); Lisi Chen (University of Electronic Science and Technology of China); Bingsheng He (National University of Singapore); Ryosuke Shibasaki (LocationMind Inc.),Not Found
Boosting Bot Detection via Heterophily-Aware Representation Learning and Prototype-Guided Cluster Discovery,Buyun He (University of Science and Technology of China); Xiaorui Jiang (University of Science and Technology of China); Qi Wu (University of Science and Technology of China); Hao Liu (University of Science and Technology of China); Yingguang Yang (University of Science and Technology of China); Yong Liao (University of Science and Technology of China),June 2025
Boosting Deep Vector Quantization with Progressive Distribution Transformation,"Weikang Wang (Intelligent Computing Infrastructure Lab, Lenovo Research); Xin Zhou (Intelligent Computing Infrastructure Lab, Lenovo Research); Jun Liu (Intelligent Computing Infrastructure Lab, Lenovo Research); Weifeng Zhang (Intelligent Computing Infrastructure Lab, Lenovo Research); Huan Yan (Intelligent Computing Infrastructure Lab, Lenovo Research)",Not Found
Boosting E-commerce Content Diversity: A Graph-based RAG Approach with User Reviews,"Jiaxi Yang (College of Information Sciences and Technology, Pennsylvania State University); Yiling Jia (DeepMind, Google); Carl Yang (Department of Computer Science, Emory University); Yi Liang (DeepMind, Google); Lu Lin (College of Information Sciences and Technology, Pennsylvania State University)",Not Found
Breaking the Bottleneck: User-Specific Optimization and Real-Time Inference Integration for Sequential Recommendation,"Wenjia Xie (University of Science and Technology of China, State Key Laboratory of Cognitive Intelligence); Hao Wang (University of Science and Technology of China, State Key Laboratory of Cognitive Intelligence); Minghao Fang (University of Science and Technology of China, State Key Laboratory of Cognitive Intelligence); ruize yu (University of Science and Technology of China, State Key Laboratory of Cognitive Intelligence); Wei Guo (Huawei Noah’s Ark Lab); Yong Liu (Huawei Noah’s Ark Lab); Defu Lian (University of Science and Technology of China, State Key Laboratory of Cognitive Intelligence); Enhong Chen (University of Science and Technology of China, State Key Laboratory of Cognitive Intelligence)",Not Found
Breaking the Top-$K$ Barrier: Advancing Top-$K$ Ranking Metrics Optimization in Recommender Systems,Weiqin Yang (Zhejiang University); Jiawei Chen (Zhejiang University); Shengjia Zhang (Zhejiang University); Peng Wu (Beijing Technology and Business University); Yuegang Sun (Intelligence Indeed); Yan Feng (Zhejiang University); Chun Chen (Zhejiang University); Can Wang (Zhejiang University),August 2025
Breeding-aware Revenue Maximization for NFT Viral Marketing on Social Networks,"Ya-Wen Teng (Institute of Information Science, Academia Sinica); De-Nian Yang (Institute of Information Science, Academia Sinica); Yishuo Shi (Statistics and Information Science, Wenzhou University); Guang-Siang Lee (Research Center for Information Technology Innovation, Academia Sinica); Wang-Chien Lee (Computer Science and Engineering, The Pennsylvania State University); Philip S. Yu (Computer Science, The University of Illinois Chicago); Ming-syan Chen (Electrical Engineering, National Taiwan University)",Not Found
Breiman meets Bellman: Non-Greedy Decision Trees with MDPs,"Hector Kohler (UMR 9189 – CRIStAL, Université de Lille,CNRS, Inria, Centrale Lille); Riad Akrour (UMR 9189 – CRIStAL, Université de Lille,Inria, CNRS, Centrale Lille); Philippe Preux (UMR 9189 – CRIStAL, Université de Lille,CNRS, Inria, Centrale Lille)","22 September, 2023"
Bridging Textual-Collaborative Gap through Semantic Codes for Sequential Recommendation,"Enze Liu (Gaoling School of Artificial Intelligence, Renmin University of China); Bowen Zheng (Gaoling School of Artificial Intelligence, Renmin University of China); Wayne Xin Zhao (Gaoling School of Artificial Intelligence, Renmin University of China); Ji-Rong Wen (Gaoling School of Artificial Intelligence, Renmin University of China)","15 March, 2025"
